{
  "bundle_hash_blake3": "ff103d7756b739f8f519c123df2aea6fffec83ef4b5784758e8c8b22b15112c5",
  "bundle_hash_sha256": "04bfe2414e3248c5e6e2270eec2bfb4d0495c027f1b42cc0402a7837273fcc98",
  "bundle_id": "018f3f72-6b79-7c35-8f7d-4a3a7d2db001",
  "bundle_manifest": [
    {
      "artifact_id": "018f3f72-6b79-7c35-8f7d-4a3a7d2d0001",
      "exhibit_id": "AF-0001",
      "hash_blake3": "aaaaaaaaaaaaaaaaaaaaaaaaaaaaaaaaaaaaaaaaaaaaaaaaaaaaaaaaaaaaaaaa",
      "hash_sha256": "bbbbbbbbbbbbbbbbbbbbbbbbbbbbbbbbbbbbbbbbbbbbbbbbbbbbbbbbbbbbbbbb",
      "original_filename": "console faults.rtf"
    }
  ],
  "bundle_signature": "e9b0df5037da8c83a34228d1407f870e9244fa7234124503a002e2216b10ae0a3dab98e8a354f614e85f5bfa019fe746ce6fc9313a141b12c20c94a0ae5dc20d",
  "bundle_version": 1,
  "case_id": "MBA-2025-06-27-CS",
  "custody_chain_snapshot": [
    {
      "artifact_id": "018f3f72-6b79-7c35-8f7d-4a3a7d2d0001",
      "event_id": "018f3f72-6b79-7c35-8f7d-4a3a7d2d1001",
      "hash_at_event": "aaaaaaaaaaaaaaaaaaaaaaaaaaaaaaaaaaaaaaaaaaaaaaaaaaaaaaaaaaaaaaaa",
      "timestamp_micros": 1780000000500000
    }
  ],
  "generated_at_micros": 1780000000500000,
  "generated_by": "exodus-bundle 0.1.0",
  "hash_algorithm": "BLAKE3-256+SHA-256",
  "replay_manifest": {
    "expected_hashes": [
      "aaaaaaaaaaaaaaaaaaaaaaaaaaaaaaaaaaaaaaaaaaaaaaaaaaaaaaaaaaaaaaaa"
    ],
    "fixture_paths": [
      "tests/sealing-fixtures/"
    ],
    "serializer_version": "SERIALIZER-exodus-v1",
    "tool_versions": [
      "exodus-bundle 0.1.0",
      "ed25519",
      "blake3-256"
    ]
  },
  "serializer_spec": "SERIALIZER-exodus-v1",
  "signing_key_ref": "exodus-test-key-001; alg=Ed25519",
  "trpc_commit_receipt": "7b2263616e6f6e6963616c697a6174696f6e5f73706563223a2243414e4f4e2d76302e31222c226672616d655f68617368223a2266663130336437373536623733396638663531396331323364663261656136666666656338336566346235373834373538653863386232326231353131326335222c226672616d655f686173685f616c676f223a22424c414b45332d323536222c226b65795f6964223a2265786f6475732d746573742d6b65792d303031222c227075626c69635f6b65795f65643235353139223a2238323232356635306233383236316463383537376432363237306231333330366632666562666230343434313235313833623162623939383061366261643861222c22726563656970745f74797065223a22424541434f4e5f434f4d4d4954222c227365616c65645f61745f6d6963726f73223a313738303030303030303530303030302c227369676e61747572655f65643235353139223a226539623064663530333764613863383361333432323864313430376638373065393234346661373233343132343530336130303265323231366231306165306133646162393865386133353466363134653835663562666130313966653734366365366663393331336131343162313263323063393461306165356463323064222c227369676e65725f6964223a2265786f6475732d7365616c2d74657374227d"
}
